{
  "schema_version": 1,
  "target": {
    "id": "linux-amd64-clang",
    "os": "linux",
    "arch": "amd64",
    "compiler_family": "clang",
    "toolchain_flavor": "clang"
  },
  "strategy": "source-build",
  "runtime": {
    "objc_runtime": "libobjc2",
    "objc_abi": "modern"
  },
  "components": [
    {
      "name": "libobjc2",
      "url": "https://github.com/gnustep/libobjc2.git",
      "revision": "TBD",
      "patches": []
    },
    {
      "name": "libdispatch",
      "url": "https://github.com/gnustep/libdispatch.git",
      "revision": "TBD",
      "patches": []
    }
  ]
}
